{"schemaVersion":"1.0.0","kind":"collection","id":"11111111-1111-4111-8111-111111111112","projectId":"11111111-1111-4111-8111-111111111111","slug":"matt-pocock-skills-collection","officialName":"Matt Pocock Skills","editorial":{"descriptionPtBr":"Skills promovidas para engenharia e produtividade, mantidas por Matt Pocock.","notesPtBr":"O plugin Claude e a instalação via Skills CLI são canais alternativos; não instale os dois juntos.","tags":["skills","engenharia","produtividade"]},"resourceIds":["11111111-1111-4111-8111-111111111113","11111111-1111-4111-8111-111111111114"],"packagingSupported":false,"recommendedCollectionVersionId":null}