{"schemaVersion":"1.0.0","kind":"collection","id":"390ef641-29f7-4d9f-ab95-fd87e20cc132","projectId":"f5a75356-8765-4191-a05e-5d28f4d71a46","slug":"superpowers-resources","officialName":"superpowers Resources","editorial":{"descriptionPtBr":"An agentic skills framework & software development methodology that works.","notesPtBr":null,"tags":["superpowers"]},"resourceIds":["b8f78c66-db8a-4016-9a4d-76dd8101f4b2","73a881e9-9cd2-48ed-ae28-c208932f6ab6","05ab9b7b-6de4-48b6-83ef-e1ee301a7808","b84d295d-8ccb-4676-91ea-c6bbc7a905df","4643c560-a933-4a96-be48-eb7facd61589","e47809af-954b-4099-907c-66a803a28f65","71134d0a-5dca-47dd-9b3f-c5096bf5574a","229e3027-8fb5-4942-b757-b0f6a41eaa26","1bffd192-5d11-4a3f-9b93-b5ab7b0693e4","f6c9bf17-e68b-46f4-beb9-dcb6d012bdbc","71f0f42a-4919-41b6-af74-edefcb362d35","bfe7650c-0713-4ca7-9795-74dcc5930bb9","7b4c3778-c97e-45a7-927a-25e1623d4f8b","04287240-74b6-43e0-a192-fbee8794271f","22f4c2e3-f703-44d7-8b0f-c797bc1ceffd","5b92dc71-79f8-40f0-a642-c0d648f9e1dd","b566d3d9-b786-4092-8d42-136a22a77cdc","bc2bfa90-cd89-4b2b-b789-361de1fd3c59","66f2068b-65f5-47ed-818a-119279f2017c"],"packagingSupported":false,"recommendedCollectionVersionId":null}